<?xml version="1.0" encoding="UTF-8"?>
<!ELEMENT  teachingplan (course+)>
<!ELEMENT course (course-name , class-hour , exam-form)>
<!ATTLIST  course no CDATA "">
<!ELEMENT course-name (#PCDATA)>
<!ELEMENT class-hour (#PCDATA)>
<!ELEMENT exam-form (#PCDATA)>

